{
  "schemaVersion": "1.0.0",
  "dependencies": [
    {
      "dependencyId": "dep-eu-cra-reporting",
      "type": "REGULATION",
      "name": "EU Cyber Resilience Act reporting obligations and Single Reporting Platform",
      "status": "REPORTING_APPLIES_2026-09-11",
      "checkedAt": "2026-08-12T12:45:00Z",
      "sourceRefs": [
        "s83",
        "s96"
      ],
      "ideaRefs": [
        "idea-401"
      ],
      "volatility": "MEDIUM"
    },
    {
      "dependencyId": "dep-eu-drinking-water-pfas",
      "type": "REGULATION",
      "name": "Directive (EU) 2020/2184 PFAS drinking-water parameters",
      "status": "APPLICABLE",
      "checkedAt": "2026-08-12T12:45:00Z",
      "sourceRefs": [
        "s79"
      ],
      "ideaRefs": [
        "idea-398"
      ],
      "volatility": "LOW"
    },
    {
      "dependencyId": "dep-eu-soho-2024-1938",
      "type": "REGULATION",
      "name": "Regulation (EU) 2024/1938 on substances of human origin",
      "status": "ADOPTED_MOST_PROVISIONS_APPLY_2027-08-07",
      "checkedAt": "2026-08-12T12:45:00Z",
      "sourceRefs": [
        "s65"
      ],
      "ideaRefs": [
        "idea-385",
        "idea-391"
      ],
      "volatility": "MEDIUM"
    },
    {
      "dependencyId": "dep-eu-crcf-2024-3012",
      "type": "CERTIFICATION_SCHEME",
      "name": "EU Carbon Removals and Carbon Farming Certification Framework",
      "status": "ADOPTED_IMPLEMENTATION_IN_PROGRESS",
      "checkedAt": "2026-08-12T12:45:00Z",
      "sourceRefs": [
        "s69"
      ],
      "ideaRefs": [
        "idea-388"
      ],
      "volatility": "HIGH"
    },
    {
      "dependencyId": "dep-eu-industrial-carbon-capacity",
      "type": "INFRASTRUCTURE",
      "name": "EU industrial carbon transport and 2030 injection-capacity buildout",
      "status": "NZIA_2030_TARGET_IMPLEMENTATION",
      "checkedAt": "2026-08-12T18:30:00+00:00",
      "sourceRefs": [
        "s154"
      ],
      "ideaRefs": [
        "idea-388"
      ],
      "volatility": "HIGH"
    },
    {
      "dependencyId": "dep-eu-technology-infrastructure-charter",
      "type": "STANDARD",
      "name": "Voluntary Charter of Access for Industrial Users to Research and Technology Infrastructures",
      "status": "VOLUNTARY_CHARTER_ADOPTED_2026-07-28",
      "checkedAt": "2026-08-12T18:30:00+00:00",
      "sourceRefs": [
        "s155"
      ],
      "ideaRefs": [
        "idea-294"
      ],
      "volatility": "MEDIUM"
    },
    {
      "dependencyId": "dep-eu-soil-monitoring-law",
      "type": "LAW",
      "name": "EU Soil Monitoring Law and contaminated-site framework",
      "status": "IN_FORCE_TRANSPOSITION_DUE_2028-12-16",
      "checkedAt": "2026-08-12T18:30:00+00:00",
      "sourceRefs": [
        "s157",
        "s158"
      ],
      "ideaRefs": [
        "idea-398"
      ],
      "volatility": "MEDIUM"
    },
    {
      "dependencyId": "dep-eu-nature-restoration-plans",
      "type": "REGULATION",
      "name": "EU Nature Restoration Regulation and national restoration plans",
      "status": "IN_FORCE_PLANS_EXPECTED_2026-09",
      "checkedAt": "2026-08-12T18:30:00+00:00",
      "sourceRefs": [
        "s163"
      ],
      "ideaRefs": [],
      "volatility": "MEDIUM"
    },
    {
      "dependencyId": "dep-eu-digital-networks-proposal",
      "type": "REGULATION",
      "name": "Proposed Digital Networks Act and copper transition plans",
      "status": "PROPOSED_2026-01-21",
      "checkedAt": "2026-08-12T18:30:00+00:00",
      "sourceRefs": [
        "s165"
      ],
      "ideaRefs": [],
      "volatility": "HIGH"
    },
    {
      "dependencyId": "dep-eu-rail-capacity-2026-1184",
      "type": "REGULATION",
      "name": "Regulation EU 2026/1184 on railway infrastructure capacity",
      "status": "ADOPTED_FIRST_OPTIMISED_TIMETABLE_EXPECTED_2030-12",
      "checkedAt": "2026-08-12T18:30:00+00:00",
      "sourceRefs": [
        "s167"
      ],
      "ideaRefs": [
        "idea-291"
      ],
      "volatility": "MEDIUM"
    },
    {
      "dependencyId": "dep-eucc-assurance-continuity",
      "type": "STANDARD",
      "name": "EUCC assurance-continuity rules and guidance",
      "status": "OPERATIONAL_GUIDANCE_2025-12-10",
      "checkedAt": "2026-08-12T19:30:00+00:00",
      "sourceRefs": [
        "s170"
      ],
      "ideaRefs": [
        "idea-401"
      ],
      "volatility": "MEDIUM"
    },
    {
      "dependencyId": "dep-eu-medical-countermeasure-readiness",
      "type": "INFRASTRUCTURE",
      "name": "HERA ever-warm manufacturing and strategic stockpile readiness",
      "status": "ACTIVE_PROGRAM",
      "checkedAt": "2026-08-12T19:30:00+00:00",
      "sourceRefs": [
        "s171",
        "s172",
        "s183"
      ],
      "ideaRefs": [
        "idea-377"
      ],
      "volatility": "HIGH"
    },
    {
      "dependencyId": "dep-eu-ip-backed-finance-roadmap",
      "type": "STANDARD",
      "name": "European IP-Backed Finance Roadmap",
      "status": "ROADMAP_ENDORSED_OPERATIONAL_COMPONENTS_EXPECTED_2027",
      "checkedAt": "2026-08-12T19:30:00+00:00",
      "sourceRefs": [
        "s173",
        "s174"
      ],
      "ideaRefs": [
        "idea-333"
      ],
      "volatility": "HIGH"
    },
    {
      "dependencyId": "dep-eu-imera",
      "type": "REGULATION",
      "name": "Internal Market Emergency and Resilience Act",
      "status": "IN_APPLICATION_SINCE_2026-05-29",
      "checkedAt": "2026-08-12T19:30:00+00:00",
      "sourceRefs": [
        "s175"
      ],
      "ideaRefs": [
        "idea-373"
      ],
      "volatility": "MEDIUM"
    },
    {
      "dependencyId": "dep-eu-construction-products-2024-3110",
      "type": "REGULATION",
      "name": "Revised Construction Products Regulation EU 2024/3110",
      "status": "IN_FORCE_PHASED_IMPLEMENTATION",
      "checkedAt": "2026-08-12T19:30:00+00:00",
      "sourceRefs": [
        "s178"
      ],
      "ideaRefs": [
        "idea-175",
        "idea-394"
      ],
      "volatility": "MEDIUM"
    },
    {
      "dependencyId": "dep-eu-refueleu-aviation",
      "type": "REGULATION",
      "name": "ReFuelEU Aviation supply-chain and airport infrastructure obligations",
      "status": "IN_APPLICATION",
      "checkedAt": "2026-08-12T19:30:00+00:00",
      "sourceRefs": [
        "s181"
      ],
      "ideaRefs": [
        "idea-405"
      ],
      "volatility": "MEDIUM"
    }
  ],
  "shocks": [
    {
      "shockId": "shock-cra-reporting-start-2026",
      "dependencyId": "dep-eu-cra-reporting",
      "kind": "APPLICATION_START",
      "observedAt": "2026-08-12T12:45:00Z",
      "effectiveAt": "2026-09-11T00:00:00Z",
      "sourceRefs": [
        "s83",
        "s96"
      ],
      "affectedIdeaRefs": [
        "idea-401"
      ],
      "direction": "MIXED",
      "reviewRequired": true
    },
    {
      "shockId": "shock-pfas-parameters-start-2026",
      "dependencyId": "dep-eu-drinking-water-pfas",
      "kind": "APPLICATION_START",
      "observedAt": "2026-08-12T12:45:00Z",
      "effectiveAt": "2026-01-12T00:00:00Z",
      "sourceRefs": [
        "s79"
      ],
      "affectedIdeaRefs": [
        "idea-398"
      ],
      "direction": "MIXED",
      "reviewRequired": true
    },
    {
      "shockId": "shock-carbon-injection-capacity-target",
      "dependencyId": "dep-eu-industrial-carbon-capacity",
      "kind": "NEW_LAW",
      "observedAt": "2026-08-12T18:30:00+00:00",
      "effectiveAt": "2030-01-01T00:00:00Z",
      "sourceRefs": [
        "s154"
      ],
      "affectedIdeaRefs": [
        "idea-388"
      ],
      "direction": "POSITIVE",
      "reviewRequired": true
    },
    {
      "shockId": "shock-technology-infrastructure-charter",
      "dependencyId": "dep-eu-technology-infrastructure-charter",
      "kind": "STANDARD_FINALIZED",
      "observedAt": "2026-08-12T18:30:00+00:00",
      "effectiveAt": "2026-07-28T00:00:00Z",
      "sourceRefs": [
        "s155"
      ],
      "affectedIdeaRefs": [
        "idea-294"
      ],
      "direction": "MIXED",
      "reviewRequired": true
    },
    {
      "shockId": "shock-soil-monitoring-law-in-force",
      "dependencyId": "dep-eu-soil-monitoring-law",
      "kind": "NEW_LAW",
      "observedAt": "2026-08-12T18:30:00+00:00",
      "effectiveAt": "2025-12-16T00:00:00Z",
      "sourceRefs": [
        "s157",
        "s158"
      ],
      "affectedIdeaRefs": [
        "idea-398"
      ],
      "direction": "POSITIVE",
      "reviewRequired": true
    },
    {
      "shockId": "shock-nature-restoration-plan-window",
      "dependencyId": "dep-eu-nature-restoration-plans",
      "kind": "APPLICATION_START",
      "observedAt": "2026-08-12T18:30:00+00:00",
      "effectiveAt": "2026-09-01T00:00:00Z",
      "sourceRefs": [
        "s163"
      ],
      "affectedIdeaRefs": [],
      "direction": "POSITIVE",
      "reviewRequired": true
    },
    {
      "shockId": "shock-rail-capacity-regulation-adopted",
      "dependencyId": "dep-eu-rail-capacity-2026-1184",
      "kind": "NEW_LAW",
      "observedAt": "2026-08-12T18:30:00+00:00",
      "effectiveAt": "2026-06-11T00:00:00Z",
      "sourceRefs": [
        "s167"
      ],
      "affectedIdeaRefs": [
        "idea-291"
      ],
      "direction": "MIXED",
      "reviewRequired": true
    },
    {
      "shockId": "shock-eucc-assurance-continuity-guidance",
      "dependencyId": "dep-eucc-assurance-continuity",
      "kind": "STANDARD_FINALIZED",
      "observedAt": "2026-08-12T19:30:00+00:00",
      "effectiveAt": "2025-12-10T00:00:00Z",
      "sourceRefs": [
        "s170"
      ],
      "affectedIdeaRefs": [
        "idea-401"
      ],
      "direction": "POSITIVE",
      "reviewRequired": true
    },
    {
      "shockId": "shock-imera-application-start",
      "dependencyId": "dep-eu-imera",
      "kind": "APPLICATION_START",
      "observedAt": "2026-08-12T19:30:00+00:00",
      "effectiveAt": "2026-05-29T00:00:00Z",
      "sourceRefs": [
        "s175"
      ],
      "affectedIdeaRefs": [